doc,dt,pid,texto,n_palavras
202412,2024-12-01,30,"Percentil 25 Percentil 50 Percentil 75 Percentil 99 BANCO BMG S.A. ago/24 9,74 19,48 35,88 69,40 set/24 10,73 19,48 36,22 72,80 out/24 9,74 19,48 36,20 81,05 nov/24 10,73 21,44 36,20 81,93 BANCO BRADESCARD ago/24 3,45 8,31 17,81 57,59 set/24 3,52 8,87 17,91 59,94 out/24 9,12 15,69 30,26 78,71 nov/24 4,56 12,93 22,77 82,96 BANCO BRADESCO S.A. ago/24 9,78 19,91 37,53 66,28 set/24 7,16 15,93 27,74 72,68 out/24 7,88 17,63 30,07 78,06 nov/24 8,74 18,24 32,09 82,41 BANCO BV S.A. ago/24 4,22 10,89 24,89 70,91 set/24 4,41 11,63 24,97 76,56 out/24 4,22 11,41 25,01 82,53 nov/24 4,22 11,60 25,72 86,76 BANCO C6 S.A. ago/24 3,65 6,47 12,93 41,18 set/24 4,00 6,95 14,29 42,11 out/24 3,94 6,98 14,94 41,83 nov/24 3,72 6,68 15,12 42,11 BANCO CSF S.A. ago/24 6,21 13,89 24,22 77,67 set/24 6,28 14,70 26,33 82,32 out/24 6,92 15,56 28,38 85,87 nov/24 7,11 16,47 29,81 88,38 BANCO PAN ago/24 5,22 13,58 22,55 60,74 set/24 5,16 13,75 22,58 62,39 out/24 5,00 13,65 21,94 64,22 nov/24 5,18 14,80 22,67 65,73 BANCO SANTANDER (BRASIL) S.A. ago/24 6,82 15,27 22,91 58,26 set/24 5,84 14,92 22,88 63,97 out/24 6,00 15,52 23,95 67,05 nov/24 6,14 16,42 26,51 81,53 BCO DO BRASIL S.A. ago/24 1,44 4,66 15,14 36,96 set/24 1,47 5,39 15,62 41,59 out/24 1,47 5,39 15,62 41,59 nov/24 1,47 5,98 15,68 49,73 CAIXA ECONÔMICA FEDERAL ago/24 4,90 7,82 13,16 37,41 set/24 4,50 7,32 13,15 40,19 out/24 4,57 7,46 13,16 42,60 nov/24 4,49 7,11 13,15 44,48 ITAÚ UNIBANCO S.A. ago/24 5,23 13,41 25,20 83,71 set/24 4,94 13,45 27,07 99,04 out/24 4,98 14,12 29,01 100,00 nov/24 4,36 12,36 28,07 100,00 LUIZACRED S.A. SCFI ago/24 5,61 13,64 24,09 83,48 set/24 5,01 13,15 26,12 99,91 out/24 4,89 14,11 27,89 100,00 nov/24 4,76 13,30 28,62 100,00 NU FINANCEIRA S.A. CFI ago/24 4,58 12,24 25,51 80,55 set/24 4,58 12,41 25,88 86,13 out/24 4,67 12,51 26,12 89,91 nov/24 4,58 12,72 26,92 92,45 PORTOSEG S.A. CFI ago/24 5,48 12,93 25,53 77,48 set/24 5,76 13,59 26,50 85,27 out/24 5,70 14,38 27,92 90,92 nov/24 5,84 14,78 28,52 95,07 REALIZE CFI S.A. ago/24 2,80 5,97 16,94 75,31 set/24 4,74 8,87 17,99 78,22 out/24 5,12 10,36 33,00 79,40 nov/24 3,88 7,72 17,99 79,40",354
202412,2024-12-01,31,"A Política de Revisão das Estatísticas Econômicas Oficiais Compiladas pelo Departamento de Estatísticas (DSTAT) do Banco Central do Brasil , 3ª edição, de junho de 2023, estabelece que revisões extraordinárias devem ser efetuadas e informadas tão logo sejam identificados erros nas fontes de informações.",44
202412,2024-12-01,32,"Em decorrência de inconsistência na classificação do controle de capital em uma instituição financeira na base de dados do Banco Central , as séries de código s SGS 13672 (Percentual do total de provisões em relação à carteira de crédito das instituições financeiras sob controle privado nacional) e 13678 (Percentual do total de provisões em relação à carteira de crédito das instituições financeiras sob controle estrangeiro) foram publicadas com valores incorretos para os dados posteriores a julho de 2024. Os valores dessas estatísticas foram revisados e retificad os no Sistema Gerenciador de Séries Temporais do Banco Central (SGS) na presente divulgação.",101
202501,2025-01-01,1,"Nota para a Imprensa – 27.1.2025 Errata: em 28 de janeiro de 2025, a informação referente às concessões dessazonalizadas foi corrigida no texto e nas tabelas 2, 3, 4 e 5.",31
202501,2025-01-01,2,"Em dezembro de 2024, o sald o do crédito ampliado ao setor não financeiro situou -se em R$1 8,4 trilhões (156,1% do PIB), com expansão de 13,9% em relação a dezembro de 2023. Destacaram -se os aumentos dos saldos de emp réstimos do SFN , 10,5%; de títulos públicos de dívida , 9,4%; e de empréstimos externos , 26,2%.",59
202501,2025-01-01,3,"O crédito ampliado às empresas atingiu R$ 6,6 trilhões (5 6,0% do PIB), com expansão de 18,7% no ano, influenciada pelo crescimento de 26,3% nos empréstimos externos e de 2 7,6% em títulos de dívida .",36
202501,2025-01-01,4,"O crédito ampliado às famílias alcançou R$ 4,2 trilhões (3 5,5% do PIB) em 2024, com expans ão de 1 0,6%, refletindo a elevação de 12,1% na carteira de empréstimos do SFN .",33
202501,2025-01-01,5,2. Operações de crédito do Sistema Financeiro Nacional (SFN),9
202501,2025-01-01,6,"O saldo das operações de crédito do SFN em 2024 totalizou R$6,4 trilhões , com expansão de 10,9 % no ano , com aceleração no ritmo de crescimento comparativa - mente a 2023, quando a expansão em doze meses alcançou 8,1%. A aceleração ocorreu tanto no crédito às empresas ( 9,1% ante 4,7% em 202 3), quanto no crédito às famílias (1 2,1% ante 10,5% em 202 3). No mês de dezembro, o saldo de crédito total cresceu 1,4%, com incrementos de 2, 3% no segmento de pessoas jurídicas e de 0,8% no de pessoas físicas. 0510152025 dez 22 fev 23 abr 23 jun 23 ago 23 out 23 dez 23 fev 24 abr 24 jun 24 ago 24 out 24 dez 24%Saldos de crédito -Variação em 12 meses Total Pessoa Jurídica Pessoa Física",134
202501,2025-01-01,7,"Nota para a Imprensa – 27.1.2025 Em 202 4, o saldo das operações de crédito com recursos livre s alcançou R$3, 7 trilhões, aumento de 10,6 % no ano , com avanço no ritmo de expansão em relação a 202 3, quando cresceu 5,6%.",44
202501,2025-01-01,8,"O saldo das operações de crédito direcionado atingiu R$2, 7 trilhões em dezembro de 2024 , com incremento de 11,4% no ano , inferior aos 11,9% de expansão em 2023 .",31
202501,2025-01-01,9,"O crédito livre destinado às empresas somou R$1,6 trilhão em 2024 e cresceu 8,4% no ano, ante crescimento de 2,1% em 202 3. No período, destaca ram-se os crescimentos nas modalidades adiantamentos de contratos de câmbio (ACC), capital de giro com prazo inferior a 365 dias e desconto de duplicatas e outros recebíveis . No mês de dezembro, o crédito livre às pessoas jurídicas cresceu 2,7%, com destaque para desconto de duplicatas e outros recebíveis (+13, 5%, com forte influência sazonal ), capital de giro com prazo inferior a 365 dias (+15,1%) e outros crédito livres (+4,3%) .",98
202501,2025-01-01,10,"O crédito livre às famílias alcançou R$2,2 trilhões ao final de 2024 , com expansão de 12,3 % em 2024 , ante variação de 8,4% em 202 3. Destaca ram-se os incrementos nas carteiras de cartão de crédito à vista, crédito pessoal não consignado, crédito pessoal consignado para beneficiários do INSS e financiamentos para aquisição de veículos . No mês de dezembro, aumento de 1,0%, com destaque para cartão de crédito à vista (+5,4%) e crédito consignado para beneficiários do INSS (+0,4).",82
202501,2025-01-01,11,"O saldo das operações de crédito com recursos direcionado s destinadas às empresas totalizou R$894,4 bilhões, com elevação de 10,4 % no ano e aceleração ante a variação de 9,6% ao final de 2023 . O crédito direcionado às famílias atingiu R$ 1,8 trilhão, expansão de 11,8 %, comparativamente ao crescimento de 13,1 % no ano anterior . Em dezembro de 2024 , o crédito direcionado para as empresas cresceu 1,6% e, para as famílias , 0,6%.",77
202501,2025-01-01,12,"Nota para a Imprensa – 27.1.2025 As novas contratações nominais de crédito acumuladas no ano aumentaram 15,4 % em 2024, ante 4,7% no ano anterior. Por segmento, as concessões às empresas cresceram 17,5% (estáve is em 202 3) e, as destinadas às pessoas físicas , 13,7 % (+8,7% em 202 3). Em dezembro, a s novas contratações nominais somaram R$686,6 bilhões . Nas séries com ajuste sazonal , as concessões totais decresceram 0,2% no mês , com alta de 0,1% nas concessões às pessoas jurídicas e queda de 0,2% nas concessões às pessoas físicas . As concessões médias diárias em dezembro avançaram 0,2% em relação ao mês anterior , ressaltando -se a ocorrência de dois dias úteis a mais em dezembro .",122
202501,2025-01-01,13,"A taxa média de juros das concessões totais situou -se em 28,7% a.a. ao final de 2024 , incremento de 0,5 p.p. no ano, após redução de 1,5 p.p. em 202 3. O spread bancário das taxas de juros situou -se em 1 7,8 p.p., diminuição de 1,7 p.p. em 202 4, após avanço de 0,6 p.p. no ano anterior. No mês, a taxa média de juros e os spreads variaram 0,2 p.p. e -0,7 p.p., respectivamente .",78
202501,2025-01-01,14,"No crédito livre , a taxa média de juros alcançou 40,8% a.a. ao final de 2024 , elevação de 0,2 p.p. no ano. No crédito livre às pessoas jurídicas , a taxa de juros situou -se em 22,1% a.a., alta de 1,0 p.p. no ano, destacando -se os incrementos em capital de giro com prazo superior a 365 dias, +4,1 p.p. , e em antecipação de fatura de cartão de crédito, +1,9 p.p. No crédito livre às pessoas físicas , a taxa de juros atingiu 53,0% a.a., diminuição no ano de 0,9 p.p., com destaque para as reduções em crédito consignado para beneficiários do INSS, -1,7 p.p., cartão de crédito parcelado, -25,7 p.p., bem como para a maior participação da carteira de cartão de crédito à vista cuja s operações não têm juros . Em dezembro , a taxa média recuou -0,2 p.p. nas operações para pessoas físicas e aumentou 0,4 p.p. nas operações para pessoas jurídicas , com predomínio do efeito taxa no segmento de pessoas jurídicas e do efeito saldo na carteira de pessoas físicas , conforme tabela a seguir .",183
202501,2025-01-01,15,"O Indicador de Custo do Crédito (ICC), que mede o custo médio de todo o crédito do SFN, encerrou 202 4 em 21, 5% a.a., com redução de 0,2 p.p. no ano. No segmento de pessoas jurídicas, o ICC situou -se em 16,1% a.a., com decréscimo de 0, 5 p.p. no ano. No segmento de pessoas físicas, o ICC atingiu 25,1% a.a., com eleva ção de 0, 1 p.p. no período. No mês, variações de -0,2 p.p. no total e de -0,2 p.p. no crédito para pessas físicas, com estabilidade no crédito a pessoas jurídicas.",95
202501,2025-01-01,16,"A inadimplência do crédito total , considerados os atrasos acima de 90 dias, alcançou 3,0% da carteira ao final de 2024 , recuando 0,2 p.p. em relação ao final de 2023 . No segmento de pessoas jurídicas, inadimplência de 2,0%, após diminuição de 0,5 p.p.. No segmento de pessoas físicas , inadimplência de 3,5%, com recuo de 0,2 p.p. no ano. No mês, recuos de 0,1 p.p. no total e de 0,3 p.p. e 0, 2 p.p. no crédito às empresas e às famílias, respectivamente .",86
202501,2025-01-01,17,"No crédito com recursos livre s, a inadimplência situou -se em 4, 1%, com diminuição de 0, 4 p.p. em 2024. No crédito livre às pessoas jurídicas , inadimplência de 2,5%, com decréscimo de 0,6 p.p. no ano . No crédito livre às pessoas físicas , inadimplência de 5,3%, com redução de 0,3 p.p. no ano. No mês, os indicadores recuaram 0, 2 p.p. no crédito total com recursos livres e 0,3 p.p. no crédito livre às empresas, mantendo -se estável no crédito livre às famílias .",87
202501,2025-01-01,18,"O endividamento das famílias aumentou 0,1 p.p. em novembro (com igual variação em doze meses), alcançando 48,2% . O comprometimento de renda apresentou estabilidade no mês, situando -se em 26,3%, permanecendo em trajetória declinante desde agosto de 2024 , com variação em doze meses de -0,2 p.p. .",48
202501,2025-01-01,19,"A base monetária atingiu R$451,2 bilhões no mês de dezembro . Nos doze meses de 2024, a base monetária cresceu 6,7%, o volume de papel -moeda em circulação , 4,2%, e as reservas bancárias , 17,6 %.",37
202501,2025-01-01,20,"Entre os fluxos mensais dos fatores condicionantes da base monetária, foram expansionistas as operações com títulos públicos federais, R$211,4 bilhões (colocações líquidas de R$30,7 bilhões no mercado primário e compras líquidas de R$242,1 bilhões no mercado secundário), as operações com derivativos , R$19,9 bilhões , e os depósitos de instituições financeiras, R$35,5 bilhões ( destacando -se a liberação de depósitos voluntários a prazo, +R$34,5 bilhões). Atuaram no sentido contracionista as operações do setor externo, R$186,3 bilhões , e as operações do Tesouro Nacional, R$55,7 bilhões.",85
202501,2025-01-01,21,"Os meios de pagamento restritos (M1) totaliz aram R$708,6 bilhões, crescimento de 10,0 % no ano, em decorrência da elevação dos depósitos à vista e do papel -moeda em poder do público em 1 5,1% e 3,8%, respectivamente. Considerando -se dados dessazonalizados, o M1 cresceu 9,7% no período.",48
202501,2025-01-01,22,"O M2 avançou 1 1,6% no ano, com saldo total de R$6,6 trilhões, refletindo o crescimento do M1 e do saldo dos títulos emitidos por instituições financeiras , que em 2024 avançou 13,4 %, somando R$4,8 trilhões. Os saldos dos depósitos a prazo e das letras financeiras cresceram , respectivamente, 14,1 % e 1 9,2% , enquanto o saldo das letras de crédito avançou 8,4%. O saldo dos depósitos de poupança cresceu 4,9% (R$1,0 trilhão). O M3 aumento u 12,4%, somando R$12,2 trilhões, resultado do aumento do M2 e do saldo das quotas de fundos monetários que totalizou R$5,3 trilhões (+ 13,2 %). As operações compromissadas com títulos públicos federais avançaram 1 2,6%, enquanto as operações com títulos privados cresceram 19,1 %. O M4 avançou 12,6 % no ano, totalizando R$13,4 trilhões.",132
202501,2025-01-01,23,4. Limitação do montante de juros e encargos financeiros em cartões de crédito,13
202501,2025-01-01,24,"A Lei nº 14.690 , de 3 de outubro de 2023, determinou que , no crédito rotativo e no parcelamento d o saldo devedor das faturas de cartões de crédito e de outros instrumentos de pagamento pós -pagos , o montante total cobrado a título de juros e encargos financeiros não poderá exceder o valor original da dívida .",59
202501,2025-01-01,25,"Visando contribuir para o acompanhamento dos efeitos dessa legislação, o Banco Central passou a divulgar em página específica os percentuais acumulados dos montantes de juros e encargos nas operações de cartão rotativo e parcelado a partir da entrada em vigor da lei. Esses dados mostra m a distribuição de frequência da proporção dos montantes de juros e encargos financeiros cobrados pelas instituições financeiras em relação ao valor original da dívida e estão disponíveis no endereço www.bcb.gov.br/estatisticas/juros -cartao -de-credito ou pelo caminho Estatísticas > Taxas de Juros > Juros acumulados no cartão de crédito.",93
202501,2025-01-01,26,"Percentil 25 Percentil 50 Percentil 75 Percentil 99 BANCO BMG S.A. set/24 10,73 19,48 36,22 72,80 out/24 9,74 19,48 36,20 81,05 nov/24 10,73 21,44 36,20 81,93 dez/24 10,73 21,45 36,22 81,95 BANCO BRADESCARD set/24 3,52 8,87 17,91 59,94 out/24 9,12 15,69 30,26 78,71 nov/24 4,56 12,93 22,77 82,96 dez/24 4,12 12,87 22,94 85,69 BANCO BRADESCO S.A. set/24 7,16 15,93 27,74 72,68 out/24 7,88 17,63 30,07 78,06 nov/24 8,74 18,24 32,09 82,41 dez/24 9,11 18,13 33,15 86,81 BANCO BV S.A. set/24 4,41 11,63 24,97 76,56 out/24 4,22 11,41 25,01 82,53 nov/24 4,22 11,60 25,72 86,76 dez/24 4,22 11,02 25,76 89,00 BANCO C6 S.A. set/24 4,00 6,95 14,29 42,11 out/24 3,94 6,98 14,94 41,83 nov/24 3,72 6,68 15,12 42,11 dez/24 4,08 7,15 15,50 44,44 BANCO CSF S.A. set/24 6,28 14,70 26,33 82,32 out/24 6,92 15,56 28,38 85,87 nov/24 7,11 16,47 29,81 88,38 dez/24 7,20 16,47 31,08 89,86 BANCO PAN set/24 5,16 13,75 22,58 62,39 out/24 5,00 13,65 21,94 64,22 nov/24 5,18 14,80 22,67 65,73 dez/24 5,40 14,99 22,26 68,84 BANCO SANTANDER (BRASIL) S.A. set/24 5,84 14,92 22,88 63,97 out/24 6,00 15,52 23,95 67,05 nov/24 6,14 16,42 26,51 81,53 dez/24 6,10 16,08 27,25 71,22 BCO DO BRASIL S.A. set/24 1,47 5,39 15,62 41,59 out/24 1,47 5,39 15,62 41,59 nov/24 1,47 5,98 15,68 49,73 dez/24 1,45 8,16 15,74 60,16 CAIXA ECONÔMICA FEDERAL set/24 4,50 7,32 13,15 40,19 out/24 4,57 7,46 13,16 42,60 nov/24 4,49 7,11 13,15 44,48 dez/24 5,07 8,08 14,06 46,76 ITAÚ UNIBANCO S.A. set/24 4,94 13,45 27,07 99,04 out/24 4,98 14,12 29,01 100,00 nov/24 4,36 12,36 28,07 100,00 dez/24 5,58 13,91 30,66 100,00 LUIZACRED S.A. SCFI set/24 5,01 13,15 26,12 99,91 out/24 4,89 14,11 27,89 100,00 nov/24 4,76 13,30 28,62 100,00 dez/24 6,01 14,66 31,06 100,00 NU FINANCEIRA S.A. CFI set/24 4,58 12,41 25,88 86,13 out/24 4,67 12,51 26,12 89,91 nov/24 4,58 12,72 26,92 92,45 dez/24 4,67 12,22 26,64 94,32 PORTOSEG S.A. CFI set/24 5,76 13,59 26,50 85,27 out/24 5,70 14,38 27,92 90,92 nov/24 5,84 14,78 28,52 95,07 dez/24 6,36 15,26 30,10 97,29 REALIZE CFI S.A. set/24 4,74 8,87 17,99 78,22 out/24 5,12 10,36 33,00 79,40 nov/24 3,88 7,72 17,99 79,40 dez/24 4,51 7,72 17,86 76,77",354
202502,2025-02-01,1,Nota para a Imprensa – 13.03.2025 1. Crédito ampliado ao setor não financeiro,13
202502,2025-02-01,2,"Em janeiro, o saldo do crédito ampliado ao setor não financeiro atingiu R$18,5 trilhões (155,6% do PIB), com queda de 0,8% no mês, resultante do decréscimo de 4,8% n o estoque d as captações externas – refletindo a apreciação cambial de 5,9% no período. Em doze meses, o crédito ampliado cresceu 14,4%, com avanços de 16,5% nos títulos de dívida e de 11,4% nos empréstimos locais .",67
202502,2025-02-01,3,"O crédito ampliado às empresas somou R$6,6 trilhões em janeiro (55,2% do PIB), diminuição de 1,9% no mês, ressaltando -se os recuos de 4,4% nos empréstimos externos e de 2,0% nos do SFN. Em relação a janeiro de 2024, o crescimento de 17,8% da carteira decorreu, principalmente, das elevações de 30,1% em títulos de dívida e de 16,8% nos empréstimos externos.",61
202502,2025-02-01,4,"O crédito ampliado às famílias atingiu R$4,3 trilhões (36,3% do PIB), com expansões de 1,1% no mês e de 12,6% em doze meses, refletindo, basicamente, o desempenho dos empréstimos do SFN.",31
202502,2025-02-01,5,2. Operações de crédito do Sistema Financeiro Nacional (SFN),9
202502,2025-02-01,6,"O saldo das operações de crédito do SFN manteve -se estável em janeiro , totalizando R$6, 5 trilhões . Esse desempenho decorreu do incremento de 1,2% na carteira de crédito às pessoas físicas, saldo de R$4,0 trilhões, atenuado pela redução de 1,8% n o saldo das pessoas jurídicas, que situou -se em R$2,5 trilhões . Em doze meses, o crédito do SFN assinalou maior ritmo de expansão, com crescimento de 11,7% , ante 11,5% no mês anterior . Por segmento , nas mesmas bases de comparação, os saldos de crédito às empresas e às famílias registraram aceleração, com avanços, na ordem , de 10,2% ante 9,9% e de 12,7% ante 12,5% .",112
202502,2025-02-01,7,"O saldo das operações de crédito com recursos livres alcançou R$3, 7 trilhões em janeiro , com diminuição de 0,5% no mês e incremento de 11,5% comparativamente ao mesmo período do ano anterior . O crédito livre para empresas somou R$1,5 trilhão, com recuo mensal de 3,2% e incremento de 9,7% em doze meses . Esse resultado refletiu , em grande parte , a redução da carteira de desconto de duplicatas e outros recebíveis ( -15,6%), após aumento sazonal ocorrido em dezembro, bem como os recuos nos estoques de capital de giro total (-1,0%), adiantamento de contratos de câmbio – ACC ( -2,4%), repasses extern os (-6,8%) e antecipação de faturas de cartão de crédito ( -2,6%). 0510152025 jan 23 mar 23 mai 23 jul 23 set 23 nov 23 jan 24 mar 24 mai 24 jul 24 set 24 nov 24 jan 25%Saldos de crédito -Variação em 12 meses Total Pessoa Jurídica Pessoa Física",155
202502,2025-02-01,8,"O crédito livre às familias avançou 1,4% no mês e 12,7% comparativamente a janeiro do ano anterior , totalizando R$2,2 trilhões . Esse desempenho foi bastante disseminado entre suas principais modalidades, com destaque para crédito pessoal não consignado (2,6%), financiamento para aquisição de veículos (2,0%), crédito pessoal consignado para beneficiários do INSS (2,3%) e cartão de crédito rotativo (6,7%).",59
202502,2025-02-01,9,"O saldo das operações de crédito com recursos direcionados totalizou R$2,7 trilhões, com alta s de 0,9% no mês e de 12,1% sobre o mesmo período do ano anterior . Por segmento, o crédito direcionado às pessoas jurídicas avançou 0,6% no mês e 11,1% em doze meses, somando R$901,7 bilhões, enquanto no crédito destinado às pessoas físicas atingiu R$1,8 trilhão, com aumentos de 1,0% e de 12,6%, na mesma ordem.",70
202502,2025-02-01,10,"As concessões nominais de crédito do SFN somaram R$585,9 bilhões em janeiro . Nas séries com ajuste sazonal , as concessões avançaram 0,4% no mês, com diminuição de 0, 1% nas operações contratadas por empresas e aumento de 1,6% nas pactuadas com famílias . Nos doze meses acumulados até janeiro , as concessões nominais cresceram 15,2%, com elevações de 18,1 % nas operações com pessoas jurídicas e de 13,1% nas destinadas às pessoas físicas . As concessões médias diárias em janeiro recuaram 19,9 % em relação ao mês anterior, ressaltando -se a ocorrência de um dia útil a mais em janeiro , compara tivamente a dezembro .",107
202502,2025-02-01,11,"A taxa média de juros das concessões alcançou 29,8% a.a. em janeiro , com elevações de 1,2 p.p. no mês e 1,7 p.p. em doze meses . Nas operações pactuadas com pessoas jurídicas , a taxa média de juros atingiu 21,4% a.a., com elevações de 2,0 p.p. no mês e de 1,7 p.p. em doze meses . Na mesma ordem, as taxas médias de juros das operações contratadas com pessoas físicas registraram incrementos de 0,7 p.p. e 1,5 p.p., situando -se em 33,8% a.a .",85
202502,2025-02-01,12,"O spread bancário, que mede a diferença entre as taxas médias de juros das operações de crédito e o custo de captação, alcançou 18,6 p.p., com alta mensal de 0,9 p.p. e redução de 0,8 p.p. em doze meses .",40
202502,2025-02-01,13,"Nas operações livremente pactuadas , a taxa média de juros atingiu 42,3% a.a. , assinalando elevações de 1,6 p.p. no mês e 2,0 p.p. em doze meses . Nas operações de crédito livre às empresas, a taxa média de juros situou -se em 24,2% a.a., com avanços de 2,5 p.p. no mês e 1,7 p.p. comparativamente ao mesmo 350400450500550600650700750 jan 23 mar 23 mai 23 jul 23 set 23 nov 23 jan 24 mar 24 mai 24 jul 24 set 24 nov 24 jan 25R$ bilhõesConcessões de crédito Dessazonalizado Nominal",90
202502,2025-02-01,14,"Nota para a Imprensa – 13.03.2025 período do ano anterior. Foram determinantes para esse resultado, os incrementos nas taxas médias de juros das operações de cartão de crédito rotativo (+103,1 p.p.), capital de g iro com prazo até 365 dias (+9,3 p.p.) e capital de giro com prazo superior a 365 dias (+1,7 p.p.).",54
202502,2025-02-01,15,"No segmento de crédito livre às famílias , a taxa média de juros aumentou 0,8 p.p. no mês e 1,6 p.p. em doze meses, situando -se em 53, 9% a.a. Esse desempenho foi impulsionado pelas elevações das taxas de crédito pessoal não consignado vinculado à composição de dívidas (+5,3 p.p.) e de financiamento para a aquisição de veículos (+ 2,0 p.p.), bem como pela maior participação relativa das operações de cartão de crédito rotativo na composição da taxa média de juros do segmento .",84
202502,2025-02-01,16,"No mês , o efeito da variação das taxas de juros (efeito taxa) foi determinante para o crescimento da s taxa s média s de juros do crédito livre , conforme a tabela a seguir.",35
202502,2025-02-01,17,"O Indicador de Custo do Crédito (ICC), que mede o custo médio de toda a carteira de crédito do SFN, situou -se em 22,0% a.a. em janeiro, avançando 0,4 p.p. no mês e 0,1 p.p. em 12 meses.",38
202502,2025-02-01,18,"A inadimplência do crédito total do SFN , consider ados os atrasos superiores a 90 dias, alcançou 3, 2% da carteira em janeiro , com incremento mensal de 0,3 p.p. e redução de 0,1 p.p. na comparação com o mesmo período do ano anterior .",45
202502,2025-02-01,19,"Nas operações de crédito livre, a inadimplência avançou 0,3 p.p. no mês e recuou 0,2 p.p. em doze meses , ao atingir 4,4% da carteira. No crédito livre às pessoas jurídicas, a inadimplência alcançou 2,8% do estoque, com incremento de 0, 3 p.p. no mês e redução de 0, 5 p.p. em doze meses. A taxa de inadimplência da carteira de crédito livre às famílias também aumentou 0,3 p.p. no mês , mantendo -se estável em comparação ao mesmo período do ano anterior, em 5,5%.",85
202502,2025-02-01,20,"O endividamento das famílias situou -se em 48,3% em dezembro , permanecendo estável em relação ao mês anterior e cresc endo 0,6 p.p. comparativamente a dezembro de 202 3. O comprometimento de renda aumentou 0,5 p.p. no mês, alcançando 26,8%, maior nível desde outubro de 2023 , interrompendo a trajetória decrescente iniciada em setembro de 2024. A variação em doze meses atingiu +0,9 p.p.",64
202502,2025-02-01,21,"Taxas médias de juros (% a.a.) Variações mensais (p.p.) dez/24 jan/25Efeito TaxaEfeito Saldo Total Pessoa Física 53,1 53,9 0,3 0,5 0,8 Pessoa Jurídica 21,7 24,2 2,0 0,5 2,5 Total 40,7 42,3 1,0 0,6 1,6Crédito com Recursos Livres",37
202502,2025-02-01,22,Nota para a Imprensa – 13.03.2025 3. Agregados monetários,9
202502,2025-02-01,23,"A base monetária alcançou R$439,9 bilhões em janeiro, redução de 2,5% no mês e crescimento de 8,7% em doze meses. No s mesmo s período s, o volume de papel -moeda em circulação e as reservas bancárias recuaram 1,2% e 7,5%, respectivamente.",42
